{
  "run_id": "fixture-semantic-v1",
  "mode": "semantic_mcp",
  "fixture": true,
  "model": "synthetic-no-llm",
  "pricing": {"input_per_million": 1.0, "output_per_million": 4.0},
  "items": [
    {"question_id":"q01","answer":8,"sql":"MetricFlow: orders","tokens_input":220,"tokens_output":35,"tool_calls":1,"latency_ms":450,"invalid_join":false},
    {"question_id":"q02","answer":740,"sql":"MetricFlow: gross_revenue","tokens_input":220,"tokens_output":35,"tool_calls":1,"latency_ms":450,"invalid_join":false},
    {"question_id":"q03","answer":630,"sql":"MetricFlow: delivered_revenue","tokens_input":220,"tokens_output":35,"tool_calls":1,"latency_ms":450,"invalid_join":false},
    {"question_id":"q04","answer":92.5,"sql":"MetricFlow: average_order_value","tokens_input":220,"tokens_output":35,"tool_calls":1,"latency_ms":450,"invalid_join":false},
    {"question_id":"q05","answer":5,"sql":"MetricFlow: average_delivery_days","tokens_input":220,"tokens_output":35,"tool_calls":1,"latency_ms":450,"invalid_join":false},
    {"question_id":"q06","answer":6,"sql":"MetricFlow: orders where is_delivered=true","tokens_input":220,"tokens_output":35,"tool_calls":1,"latency_ms":450,"invalid_join":false},
    {"question_id":"q07","answer":1,"sql":"MetricFlow: orders where order_status=canceled","tokens_input":220,"tokens_output":35,"tool_calls":1,"latency_ms":450,"invalid_join":false},
    {"question_id":"q08","answer":210,"sql":"MetricFlow: gross_revenue where metric_time in 2024-04","tokens_input":220,"tokens_output":35,"tool_calls":1,"latency_ms":450,"invalid_join":false},
    {"question_id":"q09","answer":"SP","sql":"Governed model query with documented customer_id relationship","tokens_input":220,"tokens_output":35,"tool_calls":2,"latency_ms":600,"invalid_join":false},
    {"question_id":"q10","answer":110,"sql":"MetricFlow: gross_revenue - delivered_revenue","tokens_input":220,"tokens_output":35,"tool_calls":1,"latency_ms":450,"invalid_join":false}
  ]
}
